{"design":{"height":240,"width":320},"events":[{"id":"event-1","kind":"target-found","scene":"room-a","target":"target-a"},{"id":"event-2","kind":"frame-reached","scene":"room-a","frame":10}],"format":"case-recomp-scenario","id":"verified-trace-synthetic","scenes":[{"frame_end":20,"frame_start":1,"id":"room-a","targets":[{"id":"target-a","rect":[40,50,90,110],"z":1}]}],"version":1}
